{"activity":{"correlationId":"urn:uuid:9011eae0-f788-4717-a9a5-ef673d4d4800","name":"customer-address-change"},"actor":{"id":"urn:acme:verifier:crm-state","type":"verifier","version":"1.3.0"},"controlSet":{"id":"customer-write-v4","version":"4"},"controls":[{"id":"address-equals-requested","result":"PASS"},{"id":"account-number-unchanged","result":"PASS"},{"id":"credit-limit-unchanged","result":"PASS"},{"detail":"status endret fra active til suspended","id":"status-unchanged","result":"FAIL"}],"createdAt":"2026-09-18T18:58:08Z","evaluatedAt":"2026-09-18T18:58:08Z","evidenceId":"urn:uuid:7b2e94f3-0471-476e-bb5b-8e29ebfcbb99","objects":[{"contentType":"application/json","role":"observed-state","uri":"urn:uuid:63fbfbcc-2d6a-4dda-b7ab-adc2d4dd557e"},{"contentType":"application/json","role":"control-set","uri":"urn:uuid:755ed9e5-d825-4658-9d82-c078a5b49d78"},{"contentType":"application/json","role":"baseline-state","uri":"urn:uuid:353fb501-4e5d-425b-84af-b74dbc269279"}],"overall":"FAIL","schemaName":"ControlEvaluation","schemaVersion":"1","subject":{"controlArtifactSignatureSha256":"0c5b2ecca9af82546c1808120f20cb5e60678327f7771f1015b551ea46e7174f","runEndSignatureSha256":"434c3a7de1a8c70f82557eb8edb4c296e4f8a876a47db7caa856981b3863152d"}}